question.,text.
What song did Beyoncé perform at the 2009 inauguration of Obama?,America the Beautiful
What song did Beyoncé perform at the first inaugural dance for the Obamas.,At Last
What social media platform did Beyoncé upload a picture of her paper ballot on?,Tumblr
"When did Beyoncé endorse on March 26, 2013?",same sex marriage
Beyonce did an interview with which magazine and was asked about feminism?,Vogue
Beyonce supported which campaign that encourages leadership in girls?,Ban Bossy campaign
Where was Beyonce quoted as saying that she is a modern-day feminist?,Vogue
When did she say the she is a feminist?,Apr-13
What campaign did she contribute to?,Ban Bossy
What song did she release in 2013 in response to a speech?,Flawless
What does Ban Bossy encourage?,leadership in girls
"Beyoncé used words from which Nigerian author in her song, Flawless?",Chimamanda Ngozi Adichie
Which campaign does Beyoncé contribute to that encourages leadership in females?,Ban Bossy
Beyonce signed a letter with who in 2015?,the ONE Campaign
An important UN summit took place when?,Sep-15
The letter Beyonce signed focused on what issue?,women
What had to be set in developing funding?,priorities
When did Beyonce sign a letter for ONE Campaign?,2015
To whom was the letter addressed?,Angela Merkel and Nkosazana Dlamini-Zuma
Who are these women?,head of the G7 in Germany
When will they meet?,Sep-15
Who did Beyoncé sign a letter for in 2015?,the ONE Campaign
Who was the letter addressed to?,Angela Merkel and Nkosazana Dlamini-Zuma
What was Angela Merkel serving as in relation to the letter?,the head of the G7 in Germany
What did the letter want the two recipients to focus on?,women
Beyonce along with Jay Z met with whom's family after their death?,Freddie Gray
Beyonce with Jay Z gave lots of money to bail who out of prison?,protesters
Who's death caused this protest?,Freddie Gray
How much bail money did they spend?,thousands of dollars
Beyonce beat out which musical artists for most paid between June 2007 and June 2008?,Madonna and Celine Dion
Beyonce and Jay Z got a Guinness World record for what in 2009?,highest-earning power couple
Beyonce became the highest-paid black musician in which year?,2014
"Up until May of 2015, how much is Beyonce's total worth?",250 million
"Between 2008 and 2009, which entertainers did Beyonce beat in earnings?",Madonna and Celine Dion
In 2012 who placed Beyonce at 16 in the Celebrity List?,Forbes
When did she and Jay Z become the highest paid black celebrity couple?,2011
How much did she earn in 2014?,115 million
What is Beyonce's net worth in 2015?,250 million
"Who began reporting Beyoncé's annual earnings, starting in 2008?",Forbes
"When did Beyoncé become the highest paid black musician, ever?",April 2014.
Who predicted that Beyoncé would become the highest paid black entertainer?,MTV
When did Jay Z and Beyoncé become the first music couple worth over a billion dollars?,2013
Beyonce's range in singing is how many octaves?,four
who talked about Beyonce's tone and timbre as distinctive?,Jody Rosen
"Which critic called Beyonce's voice ""versatile""?",The Daily Mail
Which era was credited to have influenced Beyonce's singing style by Jody Rosen?,hip hop
How many octaves does Beyonce have?,four octaves
What did the Daily Mail say about Beyonce's voice?,versatile
What does Rosen claim influenced Beyonce's style?,hip hop
What do other critics claim?,praise her range and power
How many octaves does Beyoncé's voice span?,four
Why is Beyoncé known as the centerpiece of Destiny's Child?,Her vocal abilities
New York Times' Jon Pareles calls Beyoncé's voice velvety yet what?,tart
What does Jody Rosen say influenced Beyoncé's vocal style?,the hip hop era
Music from Beyonce is generally categorized as what genre?,R&B
"Besides R&B, which genres does Beyonce dabble in?","pop, soul and funk"
"Beyonce mostly releases English songs, but what other language did she release songs?",Spanish
Spanish songs Beyonce released were for what?,re-release of B'Day
Beyonce was coached for her Spanish songs by which American?,Rudy Perez
What kind of music does Beyonce do?,R&B
What language does she mainly sing?,English
What other language has she sung?,Spanish
What album did she re-release in Spanish?,B'Day
What style of music does Beyoncé usually perform?,R&B
What language did Beyoncé release several songs in?,Spanish
Who coached Beyoncé for her Spanish recordings?,Rudy Perez.
What album did the Spanish songs come from?,B'Day.
Beyonce does not create which aspect of her music?,beats
An example of a song aimed towards a male audience is what?,Cater 2 U
What theme was Beyonce's early music?,female-empowerment
With Jay Z what were her new themes?,man-tending anthems
What does she get credits for in her music?,co-producing credits
What part of production does she do?,melodies
Beyoncé's early recordings empowered who?,Women
"In addition to co-writing credits, Beyoncé also got what credits for most of her albums?",co-producing
"Rather than beats, what two things does Beyoncé usually come up with for producers?",melodies and ideas
Pop Songwriter of the Year award in 2001 was awarded to whom?,Beyoncé
Beyonce received the Pop Songwriter of the Year award at which event?,"American Society of Composers, Authors, and Publishers Pop Music Awards"
Beyonce has the same number of writing credits on number one singles as whom?,Diane Warren
Beyonce joined 2 other women on what list from Billboard magazine in 2011?,Top 20 Hot 100 Songwriters
When did Beyonce become the first African American woman to win Pop songwriter of the year?,2001
What place is she tied for in songwriting credits?,third
Who listed her at number 17 in their list of  Top 20 hot 100 Songwriters?,Billboard magazine
Where does she place in writing credits  for three number one songs?,third woman
"What did Beyoncé win in 2001, making her the first black woman to do so?",Pop Songwriter of the Year award
Who gave Beyoncé the Pop Songwriter of the Year award in 2001?,"the American Society of Composers, Authors, and Publishers Pop Music Awards."
"Beyoncé was one of how many women on Billboard magazine's 2011 ""Top 20 Hot 100 Songwriters"" list.",three
What number was Beyoncé on the Top 20 Hot 100 Songwriters list?,17
To whom did Beyonce credit as her major influence on her music?,Michael Jackson
How old was Beyonce when she went to her first Michael Jackson concert as a kid?,five
Beyonce gave a tribute award to who in 2006?,Michael Jackson
Beyonce cites Mariah Carey to making her want to start doing what?,vocal runs
Who influenced Beyonce?,Michael Jackson
What song by Mariah Carey influenced her?,Vision of Love
Who is Beyoncé's biggest musical influence?,Michael Jackson
What was Beyoncé's first concert?,Michael Jackson
Who does Beyoncé feel is an all-around entertainer?,Diana Ross
"Who does she credit for the inspiration to ""get up there and do what she did""?",Whitney Houston
What song caused Beyoncé to practice runs as a child?,Vision of Love
What themes were influenced by her acting role in Dreamgirls?,feminism and female empowerment
"Which singer did Beyonce honor by entertaining with her song ""Deja Vu""?",Josephine Baker
Who motivated Beyonce to explore other areas of music?,Etta James
What movie influenced Beyonce towards empowerment themes? ,Dreamgirls
How did Etta James influence her?,boldness
Where did she perform wearing Baker's hula skirt?,2006 Fashion Rocks concert
What singer inspired Beyoncé's B'Day album?,Josephine Baker.
What song did Beyoncé sing at a 2006 concert to honor Josephine Baker?,Déjà Vu
"Beyonce has noted which first lady with saying ""She proves you can do it all""?",Michelle Obama
Which month and year did Beyonce credit Madonna for inspiring her to take control of her career?,Feb-13
"Beyonce has said that who embodies the ""definition of inspiration and a strong woman""?",Oprah Winfrey
Who personally influences Beyonce?,Michelle Obama
Hoe does she describe Oprah Winfrey?,a strong woman
How does she describe Jean- Michel Basquiat?,lyrical and raw
How does Madonna influence her?,to take control of her own career
How does she describe Jay Z?,continuing inspiration
"Who inspires Beyoncé because ""she does it all?""",First Lady Michelle Obama
Who does Beyoncé describe as the definition of inspiration?,Oprah Winfrey
Who does Beyoncé describe as lyrical and raw?,Jean-Michel Basquiat
Who inspired Beyoncé to take control of her career?,Madonna
Beyonce had an all-female tour band whose name was what?,Suga Mama
Beyonce had singers in the background known by the name as?,The Mamas
The Mamas members included which 3 musicians?,"Montina Cooper-Donnell, Crystal Collins and Tiffany Moniqué Riddick"
The Mamas first appearance was when?,2006
What band did Beyonce introduce in 2006?,Suga Mama
What song name does the band Suga Mama  and a song on the B'Day album share?,Suga Mama
Where did Suga Mama band make their first appearance?,2006 BET Awards
What band supports Beyonce in her tours?,Suga Mama
What is the name of Beyoncé's female tour band?,Suga Mama
Suga Mama is also a song on which Beyoncé album?,B'Day
What are Beyoncé's backup singers called?,The Mamas
When did The Mamas make their debut?,the 2006 BET Awards
What characteristics has Beyonce received acclaim for?,stage presence and voice
Which former president of Def Jam called Beyonce the greatest entertainer alive?,L.A. Reid
